reviewId,userName,userImage,content,score,thumbsUpCount,reviewCreatedVersion,at,replyContent,repliedAt,appVersion
697f900e-4a24-433e-a9ca-081e73ebd0c9,Beril Bierszack,https://play-lh.googleusercontent.com/a/ACg8ocKpSEea5CDfPYHJneLRhHZAGea45KwVtS6I900U1NdyzbbCbg=mo,"Lambat, tiap top up harus nunggu lama dulu baru saldo masuk.",1,0,6.8.1,2024-11-02 23:07:30,Mohon maaf atas kendalanya. Apakah hingga saat ini masih belum bisa melakukan login? Untuk versi aplikasi yang digunakan oleh Kakak sudah dengan versi terbaru? Silahkan coba untuk melakukan update versi terbaru aplikasi kami.,2023-07-25 08:23:32,6.8.1
7f8c8ead-c7b7-472f-a1c7-1191a203b2ac,natasya,https://play-lh.googleusercontent.com/a-/ALV-UjXCy1aMovUeQoJUwibpKnBIaM_KlZR-5wReIkTZbJA_YY71SKBm,"bintang satu, udah pesen deket jendela, penumpang yang lain udah duduk disana tidur dengan nyenyak",1,0,6.8.1,2024-11-02 23:07:05,,,6.8.1
d145d7c7-fe90-4b31-b6ba-20ba4ae27098,ANDY MTTvlog,https://play-lh.googleusercontent.com/a-/ALV-UjXri3UmcLjqb0VQwFMViNkOlWVQ0l-9rUDRirwm3riceogMZNUB,"Embel2 bs cek KAI ACCES gak tau nua APK Busuuuuuuk ,gak bs berfungsi,,,udh bnyk keluhan gak ada penanganan sama sekali,,,,",1,0,6.8.1,2024-11-02 22:38:26,,,6.8.1
0510f0ac-acb6-4b26-87cc-6fa58dcf9044,MIRZA 2207,https://play-lh.googleusercontent.com/a-/ALV-UjXL7wdy6kEVv4CrdM09q24yskMTDMVVjNOfmYtNQTfLk497MsWI,"Bagusan yang lama. Pembayaran cepat, bisa pakai shopeepay. Saya sudah instal ulang tetap loading. Hari ini saya pesan tiket pakai kaipay saldo saya berkurang namun tiket tidak tercetak 😭😤👎",1,0,6.8.1,2024-11-02 20:52:33,,,6.8.1
204b8815-2314-4825-9668-21aac2d3546b,1984 Syaripudin,https://play-lh.googleusercontent.com/a/ACg8ocLR6k8LMJa625Du8htgAFrgkKtvoV0sjklsBG0C9HTwMC4uPg=mo,Ok,5,0,,2024-11-02 18:38:07,,,
cfdd9a1f-c049-4349-852f-d6e4d4481cb9,Krisna Mariyati,https://play-lh.googleusercontent.com/a/ACg8ocKlXZr_yvfdDpPA1G2FdaPoqyVp-xrWfcfWGCsMJaLph6SX2Q=mo,"Saya sudah isi KAI PAY / KASPRO tapi gak bisa buat bayar,padahal pin sudah bener,tapi malah keluar katanya pin salah,sampek tak ganti pin baru,berhasil ganti pin baru,giliran bayar pakek KAY PAY salah di pin lagi,padahal udah sesuai,akhirnya bayar pakai bank BCA,lgsg bisa,trus saldo KAY PAY saya apakah bisa di kembalikan atau di cairkan?,harusnya aplikasi ini memudahkan,tapi malah menyulitkan.. parah banget..",1,1,6.8.1,2024-11-02 18:10:09,,,6.8.1
e15b0bdc-45cf-44ae-9611-07f9e5ec9cfa,M K,https://play-lh.googleusercontent.com/a-/ALV-UjUnaNUfSMxvf6lAEXbK2rzN_V_8w7nU3rbiXivqk0b9M_OdD85Z,"makin kesini makin menyedihkan sekali utk pemesanan tiket onlinenya. sering down server, sangat susah utk dapat kursi padahal pemesanan udh di lakukan H-7 pukul 00:00 tepat. sekalinya dapet kursi, utk pembayaran trouble terus karna down server. alhasil di batalin ga bisa, di bayar juga ga bisa, kadang di bayar bisa tapi tiketnya ga dapet karna waiting timenya udh habis. padahal saldo udah kepotong. di komplain kek sampah uangnya ga balik. makin sampah ini aplikasi juga pelayanannya.",1,1,6.8.1,2024-11-02 17:46:37,,,6.8.1
3e2f5ec8-49b0-4420-939b-3762c3bb0998,Briva Mahardhika,https://play-lh.googleusercontent.com/a-/ALV-UjV5radN1OBGKqicmO7_XgIgifEJcfJCqKYRHsamoJyzh6pXuDPJ,1. Aplikasinya lemot (sering kadaluwarsa/loading lama) 2. Waktu yg singkat untuk pilih kursi sampai pembayaran 3. Pembayaran gaada metode M-banking 4. Top Up KAI pay prosesnya lama,1,0,6.8.1,2024-11-02 16:27:30,,,6.8.1
bd0e67e2-1714-4646-8c2c-edf1defcc5dc,Perwita Sadewo,https://play-lh.googleusercontent.com/a-/ALV-UjVquzqnKeTHDV_D43mr6ndQCRItJbCRuVQqGPDX3Wj3YYjVlxM,Oke,1,0,6.8.1,2024-11-02 16:17:28,,,6.8.1
3d3eed71-b034-4c11-952a-d60be3cf9e76,SONY “SNOE 83” ROKHANDI,https://play-lh.googleusercontent.com/a-/ALV-UjV_cCn6Kl5NtHjVNPH-2wWZTphGFHKMnrO1DJ_Ya3b5Uh3JZ0ds,Top Up Lelet.. Apk sering log out sendiri.. Payah,2,0,6.8.1,2024-11-02 15:51:27,,,6.8.1
af7807c4-cb36-4a67-9d0e-3db854d135af,Tia Setia,https://play-lh.googleusercontent.com/a-/ALV-UjXUDvfeNEfszs3febo_pNEM3Aj7oq_PCqC9s23VtrRITWNcBR893w,Di hp oppo R7s aplikasi ini tdk brfungsi dg baik. Ga bisa di upgrade & ga ada bukti tiket e boardingnya,3,0,6.7.0,2024-11-02 14:41:07,,,6.7.0
7c1d10b2-ff4a-46b9-b095-ba9f6e1e4c6e,Yusril Huda,https://play-lh.googleusercontent.com/a-/ALV-UjUpDRAibE4UTx0m_qZeAw-i-t0lODohUfUYr7O3mBPx7ElStY7Z,"Jembut jembut.... Mohon untuk diperbaiki sistemnya. Saya nunggu dari Jam 00.00 baru dapat tiket di jam 06.45. Hanya dapat notif ""sistem sedang bekerja keras""",1,0,6.8.1,2024-11-02 13:57:31,,,6.8.1
63a3f47c-b0e8-4f11-ad2c-99f59ee96136,Ardy Prasetyo,https://play-lh.googleusercontent.com/a-/ALV-UjXv9bC-8hkHJYlff8drAdkqdXS5u_POD9shn-9ZC4Lan_mQrWz-,Aps ccd. Cannot find login data ccd,1,1,6.8.1,2024-11-02 13:38:33,,,6.8.1
e8932b57-5e25-45e9-ac3c-22d0e79f2cb2,ghis nggar,https://play-lh.googleusercontent.com/a/ACg8ocIKt29kdDrQ_qCxm--yMVe3cFm_BP8oqS0Kiw_1dwQx5N_Pyg=mo,sangat membantu,5,0,6.8.1,2024-11-02 13:36:01,,,6.8.1
2e31d3a4-eaae-4f19-97c2-15bc7f6bf0e4,Mbah Witoyo,https://play-lh.googleusercontent.com/a-/ALV-UjVVeY8v5c78Y3wTq-qDnOXhFAqbJMcOVaC61cRLV31ca4gimofA,Lebih nyaman dan tepat waktu,5,0,6.7.0,2024-11-02 13:17:30,,,6.7.0
662a0705-4454-4000-af8e-e3d6f086178c,Starman Aman,https://play-lh.googleusercontent.com/a-/ALV-UjVPdbpSA7M5irqA8791Fx5-MxSMSKE7uoQEbFZ7p5Q7hAyGQJ_N,Lumayan dah,3,0,6.7.0,2024-11-02 13:09:46,,,6.7.0
ef9272ee-ee4d-4d4a-beea-3bfbf103580e,Tista Putri,https://play-lh.googleusercontent.com/a-/ALV-UjUxE13g8o0jrAHWEBIBSQkBYWOIST40B4HO5dQTuZAGpy4H23Kg,jelek,1,0,,2024-11-02 12:32:56,,,
70433540-d96d-4790-8b46-42425a51b779,Vanhaykel Maulana,https://play-lh.googleusercontent.com/a/ACg8ocLCZbk6XKyX4VZS1GXn_d5KywKlOZ8EY68joLtvN9RC1Lacww=mo,"saya baru buka kembali KAI access, tapi akun saya kenapa harus upgrade basic lagi. Padahal sblmnya sudah terdaftar dan bisa transaksi, lihat histori tiket, lihat daftar penumpang yg pernah saya input. ikutin arahan utk upgrade lagi, system bilang ""already exist"".",1,6,6.8.1,2024-11-02 12:01:49,,,6.8.1
fc03aca1-4d3e-4c6c-9de0-d20bab64b4ea,Ragil Riko Febriyanto,https://play-lh.googleusercontent.com/a-/ALV-UjWcBeaAVPilIzHr4FyNkyM1zOzpblrBj_F_mO6FLaucFYHI_xJW,Sering error gajelas,1,0,6.8.1,2024-11-02 10:17:26,,,6.8.1
10694030-4407-4cf4-ac40-93778e46528c,Bambang Anugerah,https://play-lh.googleusercontent.com/a-/ALV-UjUzXXVdYGvwsDF9hZ5NfajmGCOPsSXSy71qBmWaN7FVtpvqqE3R,Super sekali,5,0,6.7.0,2024-11-02 10:01:54,,,6.7.0
1c7515f0-1b31-4000-9d52-8a51f4405d05,Fahmi Abdul A,https://play-lh.googleusercontent.com/a-/ALV-UjX0SYfDLn_TUwa8RBCa-zwAE8ZW4FqAOXRanTQtJ1-uuiy8xok,Ribet euy,1,0,6.8.1,2024-11-02 10:00:16,,,6.8.1
d7604200-0355-4620-8100-92cdf9e55fb6,Andik Suyatno,https://play-lh.googleusercontent.com/a/ACg8ocJvcJmyoYjhlNtHy5ReZ4hmqRbCYAOVgJsv3FdyaeobMvy9RQ=mo,"Sangat di perlukan untuk transportasi, karena waktunya, pasti pas",5,0,6.7.0,2024-11-02 09:33:08,,,6.7.0
d064c38a-f75b-40fa-8668-9d291bb05994,sandy setyawan,https://play-lh.googleusercontent.com/a/ACg8ocK2WDdQrfs_aI9nnAb03joLlx6zh1qkjbmlRMQlplvDPsfZxA=mo,"saya pembatalan tapi cuma diacc pembatalan,dana gabalik padahal bayar yang refund tiket,aneh",1,0,6.8.1,2024-11-02 09:21:21,,,6.8.1
f2c78b5f-cf79-47e5-9767-c698b4cd8f79,JOVITA WAHYU FITRIANA,https://play-lh.googleusercontent.com/a-/ALV-UjXQjywnEdHEnJTMtc3Hsc1wP4B7R2Xk6wUsPSUUe3wvsFQY0pE,"top up ga masukkkkkkkkkk,leeeeeeleeettt gajelaaassss,apaaalaaahhh😑😑😑😑😑😑😑😑😑😑😑😑😡😡😡😡",1,0,6.8.1,2024-11-02 08:32:01,,,6.8.1
5b1438aa-b642-493a-9c94-959c4f693dc3,farid setiawan,https://play-lh.googleusercontent.com/a/ACg8ocLlWBD_wOha8Xij-e2b9LtbQTZsC_SwweXqHh8q-XflxMASDg=mo,Mantaap,5,0,6.8.1,2024-11-02 08:29:53,,,6.8.1
6cd591e7-c5e6-4ef9-8225-029abb702a30,Andika guritno,https://play-lh.googleusercontent.com/a-/ALV-UjWdAVac0Jo-1OWv5FJYVwOdGejKmNptJ6rwRhH-eVLXfkyNdVQ,"Rumit, jarang dapat diskon",1,0,,2024-11-02 08:16:49,,,
76378c07-7def-4de7-afe8-752f6496ffbe,Christian Wolff,https://play-lh.googleusercontent.com/a/ACg8ocK_xhmqoivT6ugYjAsCQXkRfpjmzryJedDRNoG-E2zxB_aYLg=mo,"1.Tiap mau byr tiket LRT selalu ngadat...pdahal jaringan internet kenceng 2. Abis top up saldo, masuk nya lebaran haji 3. Pembayaran selalu error 4. Riwayat bayar, top-up dan pemesanan gak pernah muncul Tolong, belajar dan benahi lagi Klo emang belum siap tolong jangan d luncurkan",2,1,6.8.1,2024-11-02 07:37:51,,,6.8.1
1633f990-6b49-4c92-8621-057b3670831e,ME Hi,https://play-lh.googleusercontent.com/a-/ALV-UjVJNjAgbw9g2ocGE_auDQ8W1gUUpZWA-8c5t0xcWNAcXWbf-v8f,Aplikasi nya gak sesimple krl acces,1,0,6.8.1,2024-11-02 07:35:00,,,6.8.1
e86ee7ce-521e-4893-aa11-47cdc809cb8f,Muhammad Syarif,https://play-lh.googleusercontent.com/a/ACg8ocJ-oYRdWYLMZgB-Yz8N4IVOBrj7QMvPbDcAGDijOEW2qZztUQ=mo,Mo daftar akun aja susah nya minta ampun gagal terus,1,1,,2024-11-02 07:10:54,,,
6bf285f1-a205-4a02-ae51-40e597fc7287,Yansah Arin,https://play-lh.googleusercontent.com/a/ACg8ocI9fc0nV1T8fm2-Mfw3148R_1ThupvQnaOEoJw2GnWEgGGlBg=mo,"Aplikasi bobrok,saya mw pesen tiket di arahin lengkapi data,,sudah saya lengkapi data2 saya tetep aja gk bisa pesen tiket,,gw kasih bintang 1 dan aplikasi saya hapus",1,1,6.8.1,2024-11-02 07:04:23,,,6.8.1
cb151c1d-4598-4649-ac58-f9fed921d031,Muhammad Rizki,https://play-lh.googleusercontent.com/a-/ALV-UjUoIe4RRh09VZsAHBYid0hJ-ZOQvNsFk60X4eL6gmpdCjR8Ckra,Mantap,5,0,6.8.1,2024-11-02 03:35:48,,,6.8.1
47313d1c-955a-49dc-af0c-398f573da020,Raden syarif Rangka lawi,https://play-lh.googleusercontent.com/a/ACg8ocJoJl1L8FM5LzZPioRPRahEvW4vCUBCC0rdKohgoptJ4zt3dw=mo,Ok,5,0,,2024-11-02 01:39:07,,,
af577ec9-f883-43e2-b28c-dbc7f8037c22,tugiman tugiman,https://play-lh.googleusercontent.com/a/ACg8ocLGFZZerXi3myirhOVteOScxvEKyf9d9VOD3czl7aqE_zQXzw=mo,Mau daftar aja susah,1,1,,2024-11-01 22:29:03,,,
f9cf2fa8-1bc8-4de4-b380-702c6bcb12b0,Rian Akbar,https://play-lh.googleusercontent.com/a/ACg8ocJRqiDn5k350z6uD9xLGsdDTI5e2frfwzpaE54H-p1EkHwFaQ=mo,"Buruk,ga bisa pesan tiket",1,0,6.8.1,2024-11-01 16:49:15,,,6.8.1
d8020358-71fd-4c18-b981-9ea0e4cc4de0,Maulana Alwi,https://play-lh.googleusercontent.com/a-/ALV-UjVwN7IVnm-7xBi3sdQCyFp82WYYByOiXycESJwUGjOkiqGyNpU,"Aplikasinya kok sering loh out sendiri kenapa ya? Padahal jaringan udah bagus, dan sudah terbaru. Tapi masih aja sering loh out sendiri. Masih mending aplikasi yg lama. Itu malah jauh lebih bagus.",3,0,6.8.1,2024-11-01 16:38:24,,,6.8.1
66c3f70e-c73b-44d8-b908-3e40298b9e46,Dian Nurseha,https://play-lh.googleusercontent.com/a/ACg8ocJ3N4b7Kb7vSlhUJTzopCDfE3n8KkseIbESl_nkmCjZWttUkQ=mo,Top up lama benerrr di korup kahh,2,0,6.8.1,2024-11-01 14:30:26,,,6.8.1
a741b3ba-e0da-4e20-8650-1af7894fe5ae,yadi esharyadi,https://play-lh.googleusercontent.com/a/ACg8ocLQnc5glcprKFCuFJkx7nPpf9QnD8M8rS_oSgUYxgK8LFMOBg=mo,"Duh, gak kompatibel dgn perangkat jika update...ada solusi developer? Ganti HP blom ada dana...",3,0,6.7.0,2024-11-01 13:51:29,,,6.7.0
54e710aa-a46f-498b-9a6c-31fa1cd353fa,muchammad rofiq,https://play-lh.googleusercontent.com/a/ACg8ocKBnu7WrlPG_BbzzKp61j3RLHbDHnVj93v3SX3gboYUQebj554=mo,"Tetep bintang 1, Gak ada perbaikan... punya BUMN logh..",1,0,6.8.1,2024-11-01 12:48:30,,,6.8.1
a89909b6-1951-4159-821a-73009baa8607,Andhini Dyah,https://play-lh.googleusercontent.com/a-/ALV-UjXs8BrUpp_Qz_Cbu35b5aGrLV5UokrvGS8LawJVXA-rvkdD5cRk,Access by KAI ini aplikasi yg sangat membantu saya dalam mobilitas pergi ke luar kota dengan kereta. Sangat mudah cara memesannya dan mudah cara pembayarannya.,5,0,6.7.0,2024-11-01 12:38:56,,,6.7.0
af5e0200-1078-46ce-b8e1-bc1a7f20ce1e,Uswatun Hasanah,https://play-lh.googleusercontent.com/a-/ALV-UjXBvYUZn3Y227Xo95lPlRaT5SC1YCZS09jdPa1v8wWF8V0q0p8,"Sudah instal aplikasinya tapu kenapa tidak muncul di beranda HP ya??? Jadi kalau mau buka apps harus ke playstore dulu, krn gak muncul di layar hp",2,0,6.8.1,2024-11-01 12:32:43,,,6.8.1
dfea6726-d9d4-459f-bf78-3b8518421a25,Nur Khopipah,https://play-lh.googleusercontent.com/a/ACg8ocIZcDYKLtqxC9Z0x_XB3b3jsWU3O6SgeOF76GnJGIfv74WJ6g=mo,Sangat membantu perjalanan,5,0,,2024-11-01 12:21:37,,,
01ef5953-89c7-4bfd-8759-fad50aa37d14,D-ndra Afriandi,https://play-lh.googleusercontent.com/a-/ALV-UjXkiC32ePqHxWgBNBBpCtwple0OXhKqXBQ-jlEFdz_hlkctZqyb,Aplikasi eror terus,1,0,,2024-11-01 12:00:50,,,
acc64363-9984-4132-b3e1-bc8f3e35dda6,Ahmad Sukri Afrizal Nasution,https://play-lh.googleusercontent.com/a-/ALV-UjWNlk0QnIDImVR_GDramlyvoFe8dBoGtMBQqX41wyRbGOxPYZc,Aplikasi ini skrg menyuru kita untuk ganti hp yg lebih tinggi speknya.sehingga di hp kita yg android sblmnya tidak bisa dipakai LG..jgan lah bgitu kalo pembaharuan aplikasi yg wajar2 aja..GK semua kita punya duit tuk ganti hp dgn spek yg tnggi.masak dhp kita yg 1 LG aplikasi kai acces dh GK bsa,1,1,6.8.1,2024-11-01 11:54:19,,,6.8.1
bcc80e7f-b375-44d9-b89e-8edd40f97c73,Namina Artina,https://play-lh.googleusercontent.com/a/ACg8ocIqZEq8tNeZ41p7m-2z_dL0Tm7pxxzwHrCqmYJVuuFy07NTcg=mo,"Perubahan Jadwal Kereta lokal per 1 November 2024 sepertinya harus di evaluasi kembali, karena penumpang kereta terjadi penumpukan dan jadi tidak nyaman. Kereta lebih lama berhenti di setiap stasiun. Semoga menjadi perhatian khusus untuk pejabat berwenang.",2,0,6.8.1,2024-11-01 10:50:06,,,6.8.1
2dbc7b04-3d58-43b8-805c-eeb1044791e2,Hu man,https://play-lh.googleusercontent.com/a-/ALV-UjU54ifoJ3M9o33rnL8CC23hXuWFHPiBvj78jcM5LGT-eWs3cyNQ,"Nyebelin sumfahh.. kesel gua mo mesen tiket kereta Ampe berkali-kali kehabisan gegara nge lag nya, errornya, kendala pembayaran lah. Mo nyambungin ke e-wallet aja susahnya beuh mantep. Gua ulang2 Mulu mesennya tapi tetep aja GK ngaruh co. Dahlah males gua dah gak mood buat berangkat juga. Kesel Plis ya tolong perbaiki atau gak sediain tiket offline juga biar gak repot ke apk ginian",2,0,,2024-11-01 10:32:48,,,
4b92a83b-e40e-4587-a026-792d686541b0,Ssa Sasasita,https://play-lh.googleusercontent.com/a-/ALV-UjVUSv6fAaEXg7CDLW0FNb83ShLUdsqu48nRR-A8E44Rd4fg5iEn,"Aplikasinya tolong diperbaiki masa tiba² log out sendiri ,mw masuk lg susah bgt suruh nunggu 1 jam ,lebih dr 5 jam masih gabisa",2,0,6.8.1,2024-11-01 09:28:48,,,6.8.1
96df8360-e0c5-4dcf-bd5f-560e19a6601d,Zulfa Syauqina Izzati,https://play-lh.googleusercontent.com/a-/ALV-UjVr5iQVfT4fsVfcXWxOML8gapQMU5zE6e12zZgw87I7wXQkbig,"aplikasinya sih bagus tapi keretanya selalu lebih cepat dari jadwal, jadinya sering ketinggalan",1,0,6.8.1,2024-11-01 08:57:30,,,6.8.1
9544347d-e0fc-4f91-88dc-ae2cd0f1f68e,Uloh Saepuloh,https://play-lh.googleusercontent.com/a/ACg8ocL8mKgSp0wZFeVTx3M77zrOjXopH0T8yV0Zqyn02lAeaMUFRA=mo,Sangat membantu,5,0,6.7.0,2024-11-01 08:55:36,,,6.7.0
2c3c0e75-cbce-4e42-9395-24be2a942f57,Ai Noerani,https://play-lh.googleusercontent.com/a/ACg8ocIRnoE542zDhCqAYGeQFP-Noq8AmSq1xa2svGYBBXBejuMP_Q=mo,Enakan manual lgsg ke mba kasir,2,0,6.8.1,2024-11-01 08:54:00,,,6.8.1
b3af4601-5a1a-470e-aef2-e519b72e9b3c,Agus Hermawan,https://play-lh.googleusercontent.com/a/ACg8ocLMehWYrUXDMdryh9QpnAabYkOLHhn0oNvE8_bPBhU569cs1g=mo,Memudahkan,5,0,6.5.5,2024-11-01 08:50:58,,,6.5.5
2a8a4018-4b9f-43db-8786-f4172f5b37ab,muhammad faiz,https://play-lh.googleusercontent.com/a/ACg8ocI1xy2LjelZHkAlt73TRbgApzZUomhOJUmzyk5Chn8rRJMI2T4=mo,Sering bug.. 2x pesen tiket hangus padahal sudah di bayar,1,0,,2024-11-01 08:50:12,,,
25db6e4f-2767-45a4-ab6e-e7cd97832819,M. Fauzan Zaini Dahlan Lubis,https://play-lh.googleusercontent.com/a-/ALV-UjXQBIYzTGaDZsw8DR1nB8QCzTLhOQCEzyU3EsTS5g0g3xFwNCOz,maintenance aplikasi jelek. pembayaran gagal mulu. tidak ada perbaikan. bad,1,0,6.8.1,2024-11-01 08:41:54,,,6.8.1
d0d924e6-b16b-4417-b8f3-4ef2a71bf759,Neng Ratuuu,https://play-lh.googleusercontent.com/a-/ALV-UjV6fxxLVrPOSVEw0xlFG4j-nU0Q-bND9N8Jooxup-5JQZTjxCk,Terlalu banyak upgrade sampe suka keluar sendiri appnya.. Pdhl cuma mau liat jadwal kereta doang.. Auto uninstal. Maless,1,0,,2024-11-01 08:21:49,,,
e1bde16e-1a99-4656-bacf-ffe555ec1daa,Kham Dani,https://play-lh.googleusercontent.com/a/ACg8ocK-sXUdu5sSYYTRDqSqsgT014kCmJB6uqkBzjiKqdvWSS8DwQ=mo,"Tolong diperbaiki aplikasinya sering auto logout, padahal udh top up udah masuk tiba tiba ilang saldonya, gimana tuh. Perbaiki",1,0,6.8.1,2024-11-01 07:57:34,,,6.8.1
fc4e7645-8abb-4e46-b7a4-543c8432b7d0,Vicky Setiawan,https://play-lh.googleusercontent.com/a-/ALV-UjX51-SgtRQ5gx-AYmevbpopxTeXUlXQPTBUXETXaEMvWpzdl3uX,"aplikasi busuk pemesanan tiket yg harusnya mudah menjadi sulit, mau buka riwayat pengen pembayaran malah terjadi error katanya karena jaringan padahal di tempat sini 5G kan NDLOGOKKKKK udah coba restart hp bolak balik ganti jaringan sama aja KOCAKKKK!!",1,1,6.8.1,2024-11-01 07:05:58,,,6.8.1
7508468b-02d7-4666-9fe8-a380c4a302ad,Gilang Noval,https://play-lh.googleusercontent.com/a/ACg8ocJnFX_FIOJUeB-2FRlXNhhR9IqxVzUKQ8ppOZfrajp96fVJItk=mo,Akun saya tidak bisa di gunakan lagi dan semakin rumit,1,0,6.8.1,2024-11-01 06:52:16,,,6.8.1
656008aa-345c-419e-9f22-8ddf649c907a,laros jenggirat,https://play-lh.googleusercontent.com/a/ACg8ocKHzVQh2V8IzpMvovsEwsWk0b8_-cVZWID6lDIX1eZPDPOkjA=mo,Aplikasinya sering error gak jelas... Mau booking tiket saja loadingnya lama.. Masih bagusan aplikasi yang lama... Setelah di upgrade malah gak jelas... Udah loadingnya lama sering error.!! Padahal ada seat kosong tapi di pesen gak bisa.. Tolong di perbaiki lagi aplikasinya jangan asal buat dan ambil keuntungan saja biar pengguna tidak sering kecewakecewa Mending gak usah dibuat dari pada buat aplikasi Malah gak jelas cuma ngambil keuntungan saja yang buat aplikasi ini,1,743,6.8.1,2024-11-01 06:26:07,,,6.8.1
843e9b4f-435c-49c6-b296-581e8b6d1984,Ana Nahnua,https://play-lh.googleusercontent.com/a/ACg8ocJQM76Bj66F-Em6mmra91_bxocWEKK_7dWv1V-b3_HN6ZLOng=mo,APAKAH APLIKASINYA SEDANG ERROR??? DARI PAGI TIDAK BISA DIBUKA????,1,0,,2024-11-01 06:20:45,,,
d6d44dcd-a4fd-4d1b-a231-a964699c766c,teguh prayitno,https://play-lh.googleusercontent.com/a-/ALV-UjX2QPKiHOssW22LjLrwowWwAtEB1crhyHu9nWiQyBgV8Ioiz7zjOQ,.mas kok bayar pakai qris ilang po sudah ga bs pakai qris,5,0,6.8.1,2024-11-01 06:20:32,,,6.8.1
f13d81fb-f61e-498a-9f8b-bfc1b2dce786,idham vidi tamuliko,https://play-lh.googleusercontent.com/a-/ALV-UjXgShfGUJxUVaAu8D3VCfXxfb7O7uIzwvMygyHvRWROTFpRO7BQyw,sering bug dan ujung-ujungnya kehabisan tiket,1,0,6.8.1,2024-11-01 06:19:10,,,6.8.1
c538f04f-1939-4111-a529-f018b03c87e2,Djoko Pitono,https://play-lh.googleusercontent.com/a-/ALV-UjVl5I7FrXKIsCPrcjGVoc76zGPI4cEWb0rPTP7C7HeH_Dd60o0k,eror truss,1,0,6.7.0,2024-11-01 06:18:32,,,6.7.0
3596b42a-c005-49d3-aa9e-f7886921bc91,Uut Wow,https://play-lh.googleusercontent.com/a/ACg8ocJf5WFEzDt7ouBAn-_1_5ELx50hJQO_pKmtkpRRIYGK_kewEQ=mo,"Harus belajar dari aplikasi Judi Online apa pinjaman online deh KAI access.. Masak lebih canggih mereka.. Sering error, metode pembayaran ribet gak jelas... Ganti aja deh yg pegang ni aplikasi, ambil dari mereka 🙊",1,0,,2024-11-01 06:14:47,,,
7118dd3f-93a6-4c12-bb94-043adf48edec,Asep Hardiansyah,https://play-lh.googleusercontent.com/a-/ALV-UjUAQgTw9DC0UGWj_gU5M8wPJff4L5MBLsCgS_JKp2nBz_vTq465Iw,Top up gak masuk² ngehambat perjalanan aja,3,0,6.8.1,2024-11-01 04:47:58,,,6.8.1
5ad5ef5d-bdd7-4214-a85d-f82b2b155718,Doni Romdoni,https://play-lh.googleusercontent.com/a-/ALV-UjXEJ3rXnNqhVRyjc6ZgaCPAmbAEXyAWYAKoSEFjwEq-bh7VFc8,Sangat sangat membantu....,5,0,,2024-11-01 04:32:36,,,
9b6767f3-1d05-4744-a6ec-9db772060627,riana dewiq,https://play-lh.googleusercontent.com/a-/ALV-UjUIPJG6ZKdWfONhYV4iMZ20rIv-I2jnXc9-Dh9phSOiGkdnYQIYWQ,"sistem pembayarannya gak update banget beda sm platform lainnya .. mau bayar aja susah minta ampun, waktu habis auto gagal pemesanan . buat dong beberapa pilihan bayar mbanking semua bank atau Indomaret. mau bayar pakai shopeepay juga ribet amat harus download ini itu alhasil waktu gak cukup dn tiket di batal kan .",1,2,6.8.1,2024-11-01 03:25:47,"Hai kak, bisa diinfokan dengan jelas ingin melakukan pembayaran untuk tiket kereta apa?",2024-11-01 05:37:59,6.8.1
6c7c9181-5be2-4816-ab99-88a18d08c7cd,sidendang wae,https://play-lh.googleusercontent.com/a-/ALV-UjUPqbx_LW8DeJeYuwbxhz5wCbyvpU3HjiMC4cO8wo69UzhujqM,"Ini mau login aja susah. Password udah ganti, Masih dianggap salah. OTP ngirimnya lama. Udah gitu dikunci lagi sejam karena terlalu banyak nyoba. Padahal mau mesen kereta lokal. Aduh, masa sekelas BUMN kalah sama aplikasi start up utk proses nya. Harus dirapikan lagi aplikasinya KAI Access nih.",2,0,,2024-11-01 02:19:41,,,
fb084ad1-aa2a-4b8f-9d23-7688964418a9,Djie Ton,https://play-lh.googleusercontent.com/a-/ALV-UjVDBPK4rrLHPc-wbVKYSuWSDyGLdhI5uzRkDz7PCb8z7X7oYvCVIA,"Sangat berharap sekali ,semua destinasi wisata yg sudah ternama itu lokasinya dapat dijangkau dengan naik kereta api",5,0,6.8.1,2024-11-01 01:33:13,,,6.8.1
5213857c-e907-4f9e-9bde-e9447d21580a,Arjuna Junaedi,https://play-lh.googleusercontent.com/a/ACg8ocJscTDR3RXHxKirRhozB57lx2woYaNVtQJkHa_E3OJEz8TcIA=mo,semoga lebih baik lagi,5,0,6.8.1,2024-11-01 01:11:06,,,6.8.1
28344c9e-e22a-4dae-bd23-b56edb1ac609,nobal ardhinata rahadyan,https://play-lh.googleusercontent.com/a/ACg8ocJ5H0ydsx0Jtrzkg4BTlusIq0Jvi_cqnwWPUYDEpiGqEvTy_g=mo,gagal mulu bayar pakai ovo,1,0,5.1.4,2024-10-31 23:50:30,,,5.1.4
218198b3-7dd4-4267-ac1b-16014ca5e896,NOVIKA IGNESTYA YUNANGTIRTANTORO,https://play-lh.googleusercontent.com/a-/ALV-UjURrMdoROFopVC1-w0AifDaFIZ5OCfISrsNECeunRoje8b5nKk,Tolong diperbaiki mau pesen tiket trobel2,1,0,6.8.1,2024-10-31 23:09:46,,,6.8.1
03344924-347e-40b8-baa3-c1a3cf773045,Ayumi Ay,https://play-lh.googleusercontent.com/a/ACg8ocJcKK1ETmRMtqFEHXxkQCtcmUKcR2SHjeSBLd04tj3XyyrMvl8=mo,"Ini aplikasi pemerintah bukan sih, klu punya pemerintah parah banget. Kebanyakan di korupsi kali duitnya. Error, lemot, buat bayar ribet amat ngulang-ngulang terus. Di perbaiki lagi donk yang lebih baik.",1,0,6.8.1,2024-10-31 22:38:01,,,6.8.1
f86cd2e2-ddd3-4c0e-9221-03d56e60ed38,alfanal 58,https://play-lh.googleusercontent.com/a/ACg8ocJicAxUUmSdFwsnWD9ZHi8TScj6C_ZQylCIOJIdPiwR-QZcZ5w=mo,Ngk jelas,1,0,,2024-10-31 22:13:39,,,
d551300a-d6ff-4e22-9d39-863d5921e147,Rifki Saefullah,https://play-lh.googleusercontent.com/a-/ALV-UjUuZnnJS9gRgkdAbP5AeJunjAuO3zdbkdx92V8WwGDaZP-NlA,Emang yaa PT KAI Ribet. Minimal Kembanginlah Apliaksinya.,1,0,6.8.1,2024-10-31 22:07:19,,,6.8.1
3bf62f7c-920e-43ad-9989-873c1afae49e,rosyida kiya,https://play-lh.googleusercontent.com/a/ACg8ocL0YPI4yHVBG79A-xt6P0OnFOK4JHKyB3A9cLNOHanCJ9tn5A=mo,aplikasi ini udh 2bln gj bs dipke blas...tulisan slalu kqdarluwarsa..gmn ini,1,0,6.8.1,2024-10-31 20:45:27,,,6.8.1
23928ccd-bcb3-4d90-a730-31d868dbf988,Arief Budiman,https://play-lh.googleusercontent.com/a-/ALV-UjVgbpqnnaJXExYGPmGkJEnfzF23pLJwhFBnBwzb9HksDsIPKyBzdQ,APP Busukkkkk,1,0,,2024-10-31 19:44:22,,,
f80bdfd0-87b7-4c9f-982d-a5c7af730846,alifah romeo,https://play-lh.googleusercontent.com/a-/ALV-UjWFYPpRt7kqiEBjGMnxRssl9NAp2ZehCwcFgTGp4GhiEAdP2-lSJg,pemesanan tiket kereta sore itu di mulai jam brapa ya... kok saya pesan jam 00.00 tiket kereta sore sdh penuh... dan tdk ada tmpat duduk ...,3,0,6.8.1,2024-10-31 17:51:52,,,6.8.1
4401e464-73f0-496a-8ed0-13f1a36350a1,Insan Kamil,https://play-lh.googleusercontent.com/a/ACg8ocLKxQ9I9r4PFnt7dwq-40U1P4hv6vTL0SB4nJRMoh1PDq_xaQ=mo,"Kalo KAI butuh IT buat mengembangkan aplikasi ini saya siap!, jujur IT yg di hire sekarang adalah sekumpulan orang2 yang gak punya skill dan kemampuan mumpuni dibidangnya",1,0,6.8.1,2024-10-31 16:15:44,,,6.8.1
75647753-3df6-4f57-a1bc-462d4b61a12d,Arjun najah,https://play-lh.googleusercontent.com/a/ACg8ocK9ptxglSkna6F3LJAZS6f6HN3xkXEr1C7YGRlkqi_nUUEaHg=mo,loading lama dipembayaran.. acces lambat pembayaran lambatt.. lamabbatt lah nyebelin,1,0,6.8.1,2024-10-31 16:07:52,,,6.8.1
263aea91-0384-4e55-b130-fb56c48a2261,ahmad jauhari,https://play-lh.googleusercontent.com/a-/ALV-UjXK6UgPtt4GbTxoRimBVrond9Z6RiTHSpDgnGBuQa_bBoqAaMcy,"Woy, perbaiki lg aplikasinya. Gak jelas lu",1,0,6.8.1,2024-10-31 16:06:20,,,6.8.1
6fe41c29-d6a9-4b06-864f-39366e96659d,Ikhsan Jaya,https://play-lh.googleusercontent.com/a-/ALV-UjUjytD11JNXDvXfONQecmh0g4TJemF5aGlta9WqwOH4KCdIRr4j,"Menyebalkan kenapa sekarang pake updatean basic mana loginya, udah daftar juga kagak muncul tuh login",1,1,6.8.1,2024-10-31 14:57:39,,,6.8.1
20699c06-aeeb-435b-9198-f7a0c6c77ae3,Adinata Danu,https://play-lh.googleusercontent.com/a/ACg8ocKLMgMS91LI_v2QFhEUFo3ZuTTqCFmIVrekDov5d8TXqn8pLg=mo,Aplikasi bodoh.mau bayar susah.asu,1,0,6.8.1,2024-10-31 14:48:48,,,6.8.1
9e0ce520-e4da-4a89-b762-23371f81e764,Tandok Mursito,https://play-lh.googleusercontent.com/a-/ALV-UjWiM_A_T45sofaKOO7IaYvji246Q8Oql8O2ywbhnjo_s8-BcrA,Ok,5,0,,2024-10-31 13:29:12,,,
2441ef94-b93d-439e-837f-978e937d5efe,Muhamad Fadli,https://play-lh.googleusercontent.com/a/ACg8ocJKlffUGHATRNxwShKsqK3Dd83Tc8ns2D8o45ZT2Qzd-li74qs=mo,"Aplikasi ngga bisa di pake,udh top up saldo tapi ga masuk,mau pake lewat pembayaran lain tapi malah eror terus, sekelas BUMN KAI bisa kaya gini?",1,0,6.8.1,2024-10-31 13:07:25,,,6.8.1
76ded13c-2346-450b-bc81-b95b4a071483,Hery Yoeniar Laksono,https://play-lh.googleusercontent.com/a-/ALV-UjV2vRX2DT32VdyFmzkwxt11Qbk2yMqFyLKlveSYuE9LWPajm-RI,Lambat kok ssh bgt d klik,3,0,,2024-10-31 13:00:20,,,
2677a98d-89f6-4557-bd3e-302be8d7a156,Rangga Wahyu,https://play-lh.googleusercontent.com/a-/ALV-UjXagaRTR7G6EDZR61wDF0JNXlitK9bpd7UJCussEXzz5kWoDO8D,Goog jos,5,0,6.8.1,2024-10-31 12:47:40,,,6.8.1
a158cdf2-a5a2-4dbc-a32b-89413c361dc0,mutiara rani,https://play-lh.googleusercontent.com/a-/ALV-UjX1gq0FRUUuccqOjg_IOtxPhL3yh1gWkw6H9RV3AuJ8_jDHbeo,Please lah ini baru aja isi saldo kenapa tiba² log out sendiri pas mau masuk ga bisa² pas coba ganti sandi berhasil eh pas mu masuk lagi gagal lagi. Balikin duit gua kalo masih ga bisa di buka!!!,1,0,6.8.1,2024-10-31 12:37:14,,,6.8.1
285e09a3-f874-4319-a367-a0823f8d9b06,Andika Kurniawan,https://play-lh.googleusercontent.com/a-/ALV-UjXbFlbOa0N8dayuSAlkWwCj_ZbhFv1DGCR-5qee201XflGLAl0,Sangat membantu,5,0,6.7.0,2024-10-31 12:21:19,,,6.7.0
1b5cea3a-967b-45bc-9b79-512544f0850f,Alfath Farianto,https://play-lh.googleusercontent.com/a/ACg8ocIIj1SbRYaCuNKuMmahG30DMSpnxEWlVGTTjxlSj-S_cERGcA=mo,"Tolong diperbaiki,kita sebagai customer kecewa disaat pengisian saldo KAI PAY KOK LEMOT LAMA,",1,0,6.8.1,2024-10-31 11:54:53,,,6.8.1
