reviewId,userName,userImage,content,score,thumbsUpCount,reviewCreatedVersion,at,replyContent,repliedAt,appVersion
095ed1c4-c9cc-454f-a587-3c854a7fbe27,Muhammad Zaky Permana,https://play-lh.googleusercontent.com/a/ACg8ocJpI0WTUaC5HJDXWwsm6lOJtpXg7HTqRAhJLyA31iYHHXxDHPk=mo,Terimakasih sangat membantu sekali 😇,1,0,6.8.1,2024-12-04 15:42:28,,,6.8.1
a20b73e1-604e-455e-a3aa-ea6794c0e851,Zulfadli Irvan,https://play-lh.googleusercontent.com/a-/ALV-UjW1J7hrdZRG03bKqxVaNccEH9VQDLcsVQmtPfMRc47jWJsSUhw,"Sekelas BUMN Aplikasi nya begini,, lawak",1,1,6.9.4,2024-12-04 15:05:59,,,6.9.4
8d39d23e-5f0c-4fc9-915c-862d74286814,Ethan,https://play-lh.googleusercontent.com/a-/ALV-UjXtuqnx05Cdz93u2Ws1i-CDmtJDFpDW3dakRRzvPBXGq9B958c,"mau bayar pake shopeepay lama bgt gagal terus, lemot juga, harusnya kalo update bisa lebih ditingkatkan lagi",3,0,,2024-12-04 12:56:58,,,
024d3b21-aef3-4ff5-8532-f415a5d22429,QS PROJECT,https://play-lh.googleusercontent.com/a-/ALV-UjWdwFylE9prHhn7OVdbZvhEXtGfb11eqeYTpT5WGwaODDQltl3W,"Untuk Android setelah update for close mulu, ngebug ini min? Tolong segera diperbaiki",1,3,4.3.2,2024-12-04 12:51:59,,,4.3.2
ec006905-bbf1-44f0-984d-17a2ecacb72f,Deri Rudiat,https://play-lh.googleusercontent.com/a-/ALV-UjWUs3QTs64hzGeGnvIkZ_JfJqil-2vg6HOHlm_GH-wNi-57_4aS,Setelah update malah lemot,3,0,6.9.4,2024-12-04 11:16:45,,,6.9.4
c5fb6c74-2fa9-4621-aa8c-8df84b5f2bfb,Wahyu Tommy Prabowo,https://play-lh.googleusercontent.com/a-/ALV-UjXGrV1YxlMDUfS8c-RcilUZst6sV7oGxuTxIf9dIjG5yeh910jz,"Aplikasi gk guna... lemot, gk bisa pesen, kocak hapus aja gk guna aplikasi lu tolol",1,1,6.9.4,2024-12-04 10:40:22,,,6.9.4
35cd85ec-065c-482e-8161-1d3b332b4a7b,Azizh,https://play-lh.googleusercontent.com/a/ACg8ocL932WujwngQZItg6NOjr9o8IK7dMm8TrHd1YTEk5fWSdp1O1A=mo,Setiap mau bayar tulisannya terjadi kesalahan muluuu ini udah beberapa kali gue pesen tapi pas mau bayar gitu muluuu,1,0,6.8.1,2024-12-04 10:34:41,,,6.8.1
87d48ebc-c5ff-4d0b-97b2-2de0fff17f6f,Zarkasih Arifin,https://play-lh.googleusercontent.com/a-/ALV-UjUlP1QpVq7t_J18QlX-g80PLweVa8blAaEOF0DvGRH89YTttOav,"Tidak friendly dengan hp jadul, hp jadul gabisa update aplikasinya",1,0,6.7.0,2024-12-04 10:11:43,,,6.7.0
183581fb-f2aa-4eba-b6a2-47ae6b8e6b47,Trilaks Lazuard,https://play-lh.googleusercontent.com/a-/ALV-UjVpMXp6GxhJa1vhnFb2xOeXz3OeiuH9L9HyNh0CC9cHQ482j3F2,"Kenapa se BUMN aplikasinya ribettttt... kenapa g kayak traveloka atau apa gitu. Daftar nya ribet, pake nomer ktp segala. Kayak pinjollll.",1,1,6.9.4,2024-12-04 10:01:50,,,6.9.4
c93d75c2-7da7-402a-ae88-e83372fc4e35,Muhamad Mulyana,https://play-lh.googleusercontent.com/a/ACg8ocIW_wOE2VU1aGzSFSm8Dmp4yVkHQAX8F98h98p76oYcSvdREQ=mo,"Aplikasi gajelas, susah banget buat dibuka mana lemot! Plis lah KAI klo mau apa2 online itu yang niat! Disuruh beli tiket selalu online tapi bikin aplikasi sampah kaya gini!",1,2,6.9.4,2024-12-04 09:21:03,,,6.9.4
c82a93f2-a63f-4206-b098-305225e2cb39,W. Irma,https://play-lh.googleusercontent.com/a/ACg8ocLBNfTcQ87QI3viiczTXvDeOKEINXuQr1K2hbWXhxXl4g1KWH8=mo,"Baru sekali pakai karna udah jarang bepergian pake kereta saat mau digunakan lagi udah TIDAK BISA seharusnya aplikasi untuk layanan publik dibuat simple&Ringan mudah digunakan di semua perangkat selular jenis apapun baik yg standar android maupun yg sudah update sesuai tahun baru namanya pelayanan bagus di develop dengan mutakhir jangan sampai ada notif tidak kompatible di smartphone jenis apapun, apa harus BATAL bepergian gara gara aplikasi yg tak support?smoga segera teratasi!!!",1,1,6.6.1,2024-12-04 08:53:08,,,6.6.1
fb4bf553-b3c1-4513-9b40-453f7abfd9f4,Michael Fernanda Oktavianus Santos,https://play-lh.googleusercontent.com/a-/ALV-UjVUBws-KYoU6nuobWGdkBtuatMPA0heYM4NCGcy7HIjVthx0z_o,Aplikasi karya anak bangsa yang sangat bagus dan berguna di era digitalisasi sekarang. 👍👍👍,5,0,6.9.3,2024-12-04 08:50:26,,,6.9.3
711ea181-e0f5-48bf-963b-c5af2cf2ef2f,Arif Nur,https://play-lh.googleusercontent.com/a-/ALV-UjUzge_W9qieUcASUyCziC6gKg7F_6kNYUdshV5giWHwgIlVmMNG,Update Waktu nya kereta tiba dan berangkat kurang real Kereta udah datang di online blm tiba Pas giliran kereta berangkat notif nya kereta tiba di stasiun,4,0,6.8.1,2024-12-04 08:46:06,,,6.8.1
a55d7c21-5b44-41c7-aa48-4cbe37b459a0,Hadad Surya,https://play-lh.googleusercontent.com/a-/ALV-UjXM_ni7uSVKa778cfYTfMLWlJL1JoihtysdSoP1HvOI0caPYm9Jxw,"Telat baget, gak sesuaj jadwal",1,0,6.9.2,2024-12-04 08:08:40,"mohon maaf kak, apakah terjadi kendala pada aplikasi access yang digunakan?",2024-12-04 08:39:45,6.9.2
9812e8ca-f6a5-4308-a7bd-0cd52145008b,Ilham Rivaldi,https://play-lh.googleusercontent.com/a-/ALV-UjXkwnB6S8rXbrzQXLRWiOOPU7CGqUaBk4saCMsLEU7N0rUFuFJp,"Aplikasi sangat buruk , perbaiki lagi sistemnya jangan malah di buat tambah susah",1,0,6.8.1,2024-12-04 07:05:53,"Hai kak, bisa diinfokan dengan jelas kendalanya seperti apa?

",2024-12-04 08:39:55,6.8.1
9d0e828d-a97a-46f0-9a81-3aa535e08606,DOEL JIPOY,https://play-lh.googleusercontent.com/a-/ALV-UjUJtz_V-b7neESar0hOv31cjq5u0LQAVxwSijjzOYfVs4zVR0M,oke bagus,5,1,,2024-12-04 06:17:12,,,
619706b3-52da-442c-9843-0abfa9332700,Erna Nontil,https://play-lh.googleusercontent.com/a/ACg8ocIsQnwTxvcQJ0ld3bThmvXqoYj4ZZRaUpCPqDsmssh6j_aADw=mo,Gak bsa di pakai,1,0,,2024-12-04 03:16:21,"Hai kak, bisa diinfokan dengan jelas tidak bisanya seperti apa?

",2024-12-04 06:14:56,
4885c59c-d9c1-46dd-ad94-d82d648f2190,Faiz Alfarizky Tofani,https://play-lh.googleusercontent.com/a-/ALV-UjWHLFKmKmrz2zRizhtip38vBJGWzCnuEHXDsYDLnJ_R1zaAi3DmhA,"Aplikasi yang sangat aneh! Penumpang harus melakukan pembayaran hanya diberikan waktu <60 menit. Tetapi, pas waktu penumpang melakukan pembatalan perjalanan dan pengembalian tiket, Refund sangat lama dan berhari-hari! KAI sekarang hanya fokus mencari keuntungan, bukan kepuasan pelanggan! 😒",1,0,6.8.1,2024-12-04 03:00:10,,,6.8.1
11a89a0a-6375-4752-93e5-4ddaa223d81f,Ahmad Syarip,https://play-lh.googleusercontent.com/a/ACg8ocJSa8C7c07sFvY5irr2-AAyVHASDp2zopl48aNN4u4tUuQUSw=mo,Sangat nyaman sekali,5,1,6.9.3,2024-12-04 02:44:07,,,6.9.3
d6676cfb-9570-4f05-8654-1b50a1a146a1,sugiyanti giyanti,https://play-lh.googleusercontent.com/a/ACg8ocLqdopDc9riupU8X_7KLn--KXqhvXRs7TqnXAk5XMqzL3eSNg=mo,aplikanya bagus banget,5,0,6.8.1,2024-12-04 02:30:25,,,6.8.1
e03b7cc2-aa78-4863-9314-16eab0413fbb,Vani Hartini,https://play-lh.googleusercontent.com/a/ACg8ocJsjO41dB8Z5la-zpeSjuDeL5MnurV_tml-TDpHL5NYsEadaw=mo,Masih susah masuk aksesnya,4,0,6.7.0,2024-12-04 00:25:24,,,6.7.0
609707e5-375b-497f-8449-cfdfc5abad69,Mora Khaka,https://play-lh.googleusercontent.com/a/ACg8ocLH0ItCxCNyzJxmw8D9h34kkm2BSrIxF9P4QlEHHcnK_W7QC38=mo,Pelayanan sudah baik dari KAI..baguss,5,0,6.8.1,2024-12-03 18:44:45,,,6.8.1
0a36c135-e178-41b6-896e-bc7dbb947d68,DINK PROJECT,https://play-lh.googleusercontent.com/a-/ALV-UjXiLjWHJy0Udz4v-s8kXFwdEfSWpan-fbaMh_BZsSj3W8VlrTKU,Mau topup aja susah bangettt !,2,0,6.9.3,2024-12-03 17:25:44,,,6.9.3
cdb77bd5-bbce-458d-a53f-04aebb3edcaf,Gu Gumilar,https://play-lh.googleusercontent.com/a-/ALV-UjXlSuy_OmRgWFdfFsSyOqc8NKhGLniUF9jWI3Z2TMy48pakLOe3,Untuk 1 kaka harus nya bisa di gunakan terkecuali beda kaka ..jadinya sayang hangus kalo yang gak tau 😁😁,1,0,6.9.3,2024-12-03 14:28:10,"Hai kak, berdasarkan ketentuan untuk penumpang yang akan berangkat harus bisa menunjukan identitas sesuai dengan tiketnya. terima kasih",2024-12-04 06:17:08,6.9.3
d689daaa-165b-4851-bc7b-49c32ff459be,Ragna Arok,https://play-lh.googleusercontent.com/a/ACg8ocJM7Nceq1HiqOmlWEzPpnUPOJIei8xBaGTN4Py6HJlJxNBDFw=mo,"Diperbaiki lah aplikasinya. Akun Udah lupa karena bertahun tahun lalu gak pernah dipakai, tapi gak bisa dihapus. Mau buat baru pun gak bisa karena masih bisa login akun lama yang udah gak pernah dipakai lagi bertahun tahun lalu.",1,0,,2024-12-03 14:28:05,,,
0bb32d72-9562-468b-a9ba-8e5a18dcbf1c,Lee yhoung Jay,https://play-lh.googleusercontent.com/a-/ALV-UjWAT_Xawjou_puVG2f9pF5HaAoSYvIC8b4tGZcoBxVMKmab2drvLA,SEREM LIAT KOMEN DAN BINTANG NYA GAK ADA YANG BAGUS.. PADAHAL SEJELAS BUMN PUNYA NEGARA,3,0,6.8.1,2024-12-03 14:00:51,,,6.8.1
0e14120b-c181-441d-b41f-4fd6b6e91e98,Ravenz dewa,https://play-lh.googleusercontent.com/a/ACg8ocIYogFKjW1rLIsFvoUv_IWVa9H7DZS1PVfTOHJ15nVbupc5Rg=mo,awal sy pake gk ad masalah tpi baru hari ini knp tiba tiba akun saya ad yang makai kok bisa sampe kena hack gini akun saya tolong penjelasannya ni kai gmn solusinya,3,0,6.9.3,2024-12-03 13:56:56,,,6.9.3
fbd9f65c-4667-44fc-b2eb-f676f1c65dad,Ridho Muhammad,https://play-lh.googleusercontent.com/a/ACg8ocJ6j6x_1KftiLH9TJpNLl5braNe_rMgO0iB_cf0gJhkjQRr6IY=mo,"Tidak bisa dibukak, force close terus",1,1,6.9.3,2024-12-03 13:56:28,,,6.9.3
dea82202-fa61-44cc-8a0d-20e8e634c130,Han Doko,https://play-lh.googleusercontent.com/a/ACg8ocIbvYaFQbXH-I-YfJm4CgK1-Iwzk-XsLTdPHbVefyq8d4tqJA=mo,puas,5,0,6.7.0,2024-12-03 12:04:02,,,6.7.0
060a43dc-36ba-4249-aaa3-99e841f8a01a,Gilang Aydan,https://play-lh.googleusercontent.com/a/ACg8ocJoFaikE-Qcr36JuDPmEWphuspZ_re5QRCAHVuy7P9e5CrVHA=mo,Ribet anjim,1,0,,2024-12-03 11:55:45,,,
c92567d1-fa1b-477e-b818-377636a80d0a,Muhammad Rafli,https://play-lh.googleusercontent.com/a/ACg8ocIwdBgQ68GGi49D11iFhIyTLHOsEKGJ8q9I0MN76zCYvPmHlQ=mo,"beli tiket susah amat,tolong aplikasinya diperbaiki",1,0,6.9.3,2024-12-03 11:26:42,,,6.9.3
4ffac5da-e4e0-470d-87f9-6c7ac24fb37d,new Po,https://play-lh.googleusercontent.com/a-/ALV-UjUlaQV1RUs5YxCb68t-78mEh5sHkfL8u_1lq36WP5I5ozsRDtqU,Di hp LG Velvet nge bug.. Tidak bisa dibuka. Tiap di buka pasti kembali lagi Tolong diperbaiki lagi,1,0,6.9.3,2024-12-03 11:23:17,,,6.9.3
3bb7bd6a-9ccc-498a-8eaa-f97012d26e1d,Pihak facebook,https://play-lh.googleusercontent.com/a/ACg8ocI0LmtdhMTHlDUDGLSTar3DfxIhZnYgOk83U1h3rQUC-AUYcg=mo,"Jelek banget aplikasi nya, bisa bisanya tiket ke payment cancel, malah double",1,0,,2024-12-03 09:48:46,,,
5078f983-4351-48c1-a16d-89940210e0a3,ari surya,https://play-lh.googleusercontent.com/a-/ALV-UjWuTP0qARlAABMpVUMTDGQKeOePq2lNwUdyM5iyRWNxNaMF3yUL,Setelah di update malah g bs dibuka aplikasinya,3,1,6.9.3,2024-12-03 08:31:38,,,6.9.3
b6d2b454-7949-4b8f-883c-914058dc033a,Guntur Ramadhan,https://play-lh.googleusercontent.com/a-/ALV-UjXAB966bSYs6ziuJmDmxKQ-os_7j3w4YafpStAvzxu8vUTyTbsLCw,Kenapa ya tiap klik scan aplikasi langsung force close terus? Padahal semua izin sudah di izinkan,1,2,6.9.3,2024-12-03 07:41:18,,,6.9.3
c85eb51e-a4a0-4ac1-b9b1-9e2e4e6cb3ed,Kim Junita,https://play-lh.googleusercontent.com/a-/ALV-UjXbKvhoBJWoJwoJEz7sifu2oF6zZbOmXuJpc4pL3HW1EELZPkbl,"Susah buat akun ,susah acces apapun . Nyari tiket aja gk bisa. Lemot parah. Menyebalkan!!!",1,2,,2024-12-03 07:34:59,,,
8ccd30a0-1347-421f-9030-2c8b7dc99924,Dicky Septiawan,https://play-lh.googleusercontent.com/a-/ALV-UjWK8Q-9oVtIkGZgk1_1beyNXxCFVCXzN9E9fq_8gyBgJi0SzniOZA,"Stasiun peterongan jombang tidak ada petugas loket, sudah pesan 6 tiket pakai tiket screenshot kasihan yang pesan orang tua. Tidak di bolehkan naik sama satpam alasan tidak ada petugas loket. Sudah lama jadi pelanggan kai baru kali ini pelayanan sstpam kayak 💩",1,1,6.8.1,2024-12-03 06:18:14,,,6.8.1
94e881ea-fd15-46ed-84dc-fa62a7fcc90b,Penyot Ganteng,https://play-lh.googleusercontent.com/a/ACg8ocKWCJ54e_VDE1Nqyo1va35j5WUxFGEigNgQUrkhsnXiivuaWg=mo,Kenapa tiba tiba aplikasi tidak kompatibel...,1,1,,2024-12-03 06:14:10,,,
2e3a7d4d-d1a8-4e45-84b5-9e9745500eb6,Muhammad Tamim Sirajuddin,https://play-lh.googleusercontent.com/a/ACg8ocLgf_GLA36d7JH_ReXYbRHpAUrsD3i8N581N5YAwx6tbEF9ag=mo,Tolong tambahkan metode pembayaran dengan gopay atau dana,5,0,,2024-12-03 05:57:38,,,
ee0179d8-81d4-4906-81ee-c665e856fb3b,siti khafidhoh,https://play-lh.googleusercontent.com/a-/ALV-UjUqmIaZNJxalSItU-dUl8ASaFqo43shL-qFDEvtzb-asQWXB5hp,Alhamdulillah gampang buat pesen tiketnya. G harus ke alfamart dan Indomaret dulu. Kita dirumah bisa pesen sambil tidur 2 an.,5,0,6.8.1,2024-12-03 05:16:52,,,6.8.1
9122c54f-36e8-41ca-926c-955d66c14744,Pengguna Google,https://play-lh.googleusercontent.com/a/ACg8ocJPT8W1CEC1ls0PqEFomEgwy87FyyZlckqiH7ItFpoDqBzrlg=mo,"Kai gmn sih!!! masa aku daftar pake nmr hp utk beli tiket ngga bs login mulu pdhl dl bs trs di hubungi kontak centernya ngga di jwb jwb, aplikasi eror kok di biarin aja, parahhh.",1,1,,2024-12-03 05:07:41,,,
df283a0e-9ef1-416b-a04a-7a73061bdc12,Rian To,https://play-lh.googleusercontent.com/a-/ALV-UjVAM81XiZlX9vN9zNCm1g1pDIbpJoiq0IXZp5CIhS3pbesTKmoE,"Cs nya parah bgt, mau nanyain masalah pengembalian dana, udah nunggu lama giliran di angkat sama cs nya malah langsung ngomong kalo tidak ada yang bisa kami bantu, kami akhiri panggilan ini...parah kan padahal saya belum ngomong sepatah kata pun.. Pantesan aja ratingnya jelek.",1,1,6.8.1,2024-12-03 04:11:26,,,6.8.1
d9977cc6-08c1-4f1b-8cfe-23114aa14919,andika Darma,https://play-lh.googleusercontent.com/a/ACg8ocLNRWlkfIrFp6Qf6BEq4QsJdH0eMtgv9N6Rf1qG6F7DV9VoTw=mo,"mau pesan tiket suruh daftar member!! nyoba daftar kode otp nya ngga keluar"" sekali keluar di masukin ngga bisa!?",1,2,6.9.3,2024-12-03 04:06:04,,,6.9.3
4369adaa-1cc1-4d3e-b1db-8535951ae59c,Guntur Suseno,https://play-lh.googleusercontent.com/a-/ALV-UjXlKj1mvfAC27ZxrB25vfCzsczx-Tl07pEvYPcS-UjebcpxvVk,"2 (hari) sudah setelah update, aplikasi KAI tidak bisa dibuka Senin - Selasa, 2-3 Desember 2024 Mohon bantuannya, terima kasih #tidak bisa dibuka dalam artian,, saat saya klik kai access .. aplikasi langsung menutup kembali, tidak seperti biasanya. Demikian uraian dari saya.",1,31,6.9.3,2024-12-03 03:38:36,"Hai kak, bisa diinfokan dengan jelas tidak bisanya seperti apa? jika butuh bantuan lebih lanjut silakan hubungi cc121 atau customer service di stasiun terdekat. Terima kasih",2024-12-03 02:37:06,6.9.3
da63aac2-c8e1-4119-a486-d961f0b0fda8,Arya Bayu Machmud,https://play-lh.googleusercontent.com/a-/ALV-UjXgNZLB8uTacV-qdE2g_99NQ9Ox44Qhcr9L09LC1s2XmtQwzxrR,ok,5,0,6.8.1,2024-12-03 03:34:47,,,6.8.1
b135ddb6-c6d8-4158-8e04-9b8e42a521f9,Shodiq Baabduh,https://play-lh.googleusercontent.com/a/ACg8ocLyKoTTP1DfodthmA53Zu_fQ5T3_M1i4Qbl2i7UHG91mGc3QFY=mo,Good service,5,0,6.7.0,2024-12-03 01:46:43,,,6.7.0
b8b45283-218f-4c76-9d87-4036b9fe8337,Agustinus tri Widodo,https://play-lh.googleusercontent.com/a/ACg8ocIeUbG2tAXD-jCcvqPqZ8aRdq2kb7ZH7zidQ_voT79xzIkFvA=mo,Bagus,5,0,,2024-12-03 01:46:37,,,
01d0db72-7424-499f-9994-866699d62aad,Ade Cahyadi,https://play-lh.googleusercontent.com/a-/ALV-UjWQ1T_TwF_Q9S7n9E4nkfr-c4CWa8SlMBjgCydavCpsHayLNqcJ,"Kalau top up KMT melalui KASPRO Saldonya lama masuknya, ngisi saldo dari kemarin Sampe sekarang belum masuk saldonya. Tolong diperbaiki Aplikasi ini loading terlalu lama, Ditunggu sampe 15 menit , tidak ada saldo masuk. Terima kasih.",2,9,6.9.3,2024-12-03 00:06:37,,,6.9.3
c1dc47fd-259a-4efa-8535-e68bf86caf2a,Helen Saufika,https://play-lh.googleusercontent.com/a-/ALV-UjWBec9zpZI4SdnaUYjl8ovEdUiIuy2ufeQTUMJIXL88PFy0Fo-_,"Dear Developer, saya ga bisa cek fitur live tracking, padahal sudah update kai versi terbaru. Apakah versi hp berpengaruh pada fitur tersebut? Mohon info & perbaikannya. Thanks",3,0,6.8.1,2024-12-02 15:52:58,,,6.8.1
ad93e18a-1a5e-4314-ad53-306209334b3d,posbakumadin tbn,https://play-lh.googleusercontent.com/a-/ALV-UjUB0CuKTGHSToXylC1ccjhn3C31XXWk9KP5G7IWxObZIiljQ3g,Seharusnya ada fitur pengembalian dana apa bila aplikasi pembayaran bermasalah Harap di perbaiki aplikasi nya biar tidak bikin pusing,3,0,,2024-12-02 14:39:50,,,
8c07bfee-9c46-4123-945d-d6ee3e162ec1,Fian Hayu,https://play-lh.googleusercontent.com/a/ACg8ocI4A33GTcurLQu82gWtsCjI8XJF1-ZR-v0OJShvRjdiRWEOHg=mo,Untuk update terbaru ini banyak bug dan tidak nyaman untuk digunakan. Tolong segera perbaiki,2,0,,2024-12-02 13:23:47,,,
48abdfc8-9c58-410b-94e7-fa68aa884aba,Murodi X3,https://play-lh.googleusercontent.com/a/ACg8ocIESM_nkP5kDzZ6VgFiUyyt_JnZC7-5Nj7n4HPTy4sAAlUo2Q=mo,Daftar akun member clasic susah amat.. aplikasinya sulit di mengerti,1,1,6.8.1,2024-12-02 13:18:02,,,6.8.1
37911452-d16d-4123-8fe9-f4387419dad5,REISTRING CHANNEL,https://play-lh.googleusercontent.com/a-/ALV-UjWGE2hftavpPdoVCle81cx-kB_WSgxwbUzaZNmteIJqn9Oou1TS,pada saat top up kmt masih suka eror,1,0,6.8.1,2024-12-02 12:33:50,,,6.8.1
81f65337-e4f6-4163-9cce-f8644bd2b38a,Mas Al,https://play-lh.googleusercontent.com/a-/ALV-UjXqumwOiRGE8m-xfmwXpwFVrNqAobn5MzEb1dvx-R4Cr2QxRDmx,"tolong di permudah kalau ingin membuat akun, atau mencari kembali akun yang hilang. jangan cuma bisa nya menelantarkan aja, mentang² nomer, KTP dll Masi kecantol dengan akun yang lama. pas bikin akun baru kaga bisa, benerin gimana kek caranya bikin pengguna aplikasi access by kai itu di permudah. bukanya malah di persusah",1,1,6.9.3,2024-12-02 11:31:38,,,6.9.3
ff625f89-e34f-4554-a9ad-c32c1dd0385b,Hadiです,https://play-lh.googleusercontent.com/a-/ALV-UjUTQ0Kv_-K5esv9sQujDy8FHFlRepl14IKdtsOJ68xJGjNmqM4,aplikasi lemottttt,1,0,,2024-12-02 11:17:58,,,
d78a935e-d79a-4e75-8e14-a4ddad9c4391,Ignatius Kevin,https://play-lh.googleusercontent.com/a-/ALV-UjWBj1cwNbQhwKPGRbFrLQs_vkEk9kDy6UnQKGCP5bp2Xpdhmd02,"Admin,minta tolong bug nya dikurangin",5,0,6.8.1,2024-12-02 09:50:56,,,6.8.1
58dded18-ec84-425d-b189-94cb75445f85,1034_ANGELINA STEVANI SNG,https://play-lh.googleusercontent.com/a-/ALV-UjVKJoE-ntKuLwZl3gx2Y9E7ozMjt7OcsOfLAnFZj0W1NOO5fEdo,"Buruk!! Saya udh mesan tiket dan bayar melalui ShopeePay dengan status ""Berhasil"" tetapi saat saat cek di Aplikasi Access by KAI muncul keterangan ""Ticket Has Not Been Paid"" dan Status ""Kadaluarsa"". Jujur, kesal dengan sistemnya gimana. Kadang² error!!!",1,205,6.9.3,2024-12-02 09:45:46,,,6.9.3
eedda103-e96d-4093-9ce5-aea7a50ecf10,VirusKids,https://play-lh.googleusercontent.com/a-/ALV-UjXSPMRSkONq2HT1lYAH352hq93VVSkRQIIpl0_065ROKsET9CxW,"Nyesel topup kaipay. Udah masuknya lama ditambah kena potongan pula. Rugi. Update comment 2 feb 24 - QRis gak muncul, - notenya update terbaru ada VA tapi gak ada pilihannya.",1,1,6.9.3,2024-12-02 09:29:03,"Hi kak, mohon maaf atas kendalanya, saat ini masih terdapat rate limit dari kaspronya, sehingga jika melakukan top up saldonya tidak langsung masuk dan menunggu beberapa menit.",2024-01-02 03:06:50,6.9.3
dd07b7ef-ec79-4f50-91d2-dc0bdae59995,M.Fairizul Alwani A.,https://play-lh.googleusercontent.com/a-/ALV-UjWVScBGmdcNZOU_3PWgDaVMaDJBenPpbS9RXZCZw8OpV4QpB3B_,"Aplikasi nya rada"" error, di tekan aplikasinya langsung keluar ke beranda Sudah -+7 hari",3,0,6.9.3,2024-12-02 08:17:38,,,6.9.3
1b46e7bb-4559-40dc-9f36-6d1a0a9c06af,Mukti Alimudin,https://play-lh.googleusercontent.com/a/ACg8ocIYlCNx00gyVpTZY-ltCtFkwFy-B_5EV6nX3K-217pIfvqhYQ=mo,Aplikasi sampah. Ganti paswod gak bisa2. Perusahaan milik pemerintah gak ada bener masalh aplikasi kocak,1,1,,2024-12-02 07:37:19,,,
0ebacf29-8bfa-4bea-9242-049e9ce94d71,Titi3k Handriani.,https://play-lh.googleusercontent.com/a-/ALV-UjVzMp99v00hPaLtgIzNp5pQdWtl7nL6MsahQiEZNN0N05GiiLPA,Semoga semakin terbaik...,5,0,6.9.3,2024-12-02 07:21:00,,,6.9.3
97808548-e608-40d0-9f67-519e9736476e,Awaludin Hamzah,https://play-lh.googleusercontent.com/a-/ALV-UjWyYJZAV8NW3y-AKDVxE7N637AwjqUgu6Tzz3OODqY1z5QgDw,Aplikasi dah 3 hari ga bisa di buka di hp saya,4,0,5.0.5,2024-12-02 07:18:48,,,5.0.5
d23a2d95-b5be-4a3d-98af-709d13131e17,Sonjaya Putra,https://play-lh.googleusercontent.com/a/ACg8ocImcU-D_uRI9yXosBvZWo4y4ajpfzAV6tgQC_vxpZRooatIgQ=mo,Sangat membantu dalam proses pemesanan tiket secara online,5,0,6.8.1,2024-12-02 06:28:05,,,6.8.1
7d3172d1-f06b-4080-901f-6b31962cd542,Ahmad Ardiansyah,https://play-lh.googleusercontent.com/a-/ALV-UjUlkNkyYMmvzhODQnkA0yNadfhyCXyhKu_jZcYboHO_SvWIEDx2,"penggunaan nya mudah, harga juga sangat murah",5,0,,2024-12-02 06:02:59,,,
86343779-6593-49a3-8bda-7ebb1201d61e,Tri Hatmanto,https://play-lh.googleusercontent.com/a/ACg8ocLrwF_-vVL1TIz0I-VY80vYa12gKPH0poSZSG5WfeRMBzhBOw=mo,Suka lemot kalau pas udah mau bayar!!,3,0,6.9.3,2024-12-02 05:06:56,,,6.9.3
541dc733-4be6-4a31-9d4a-ed9ff43324c1,Tri Suwanto,https://play-lh.googleusercontent.com/a/ACg8ocLQ6GQ3OENZmLj6ZS4TSdrNboeBJsFEnREF_oNnLQBaDV_wXw=mo,Aplikasi jiancok mau pesen tiket aja susah bgt,1,0,6.8.1,2024-12-02 04:31:29,,,6.8.1
4f7da87a-3dcb-49e7-8789-1cc530be489d,Heri Kuswanto,https://play-lh.googleusercontent.com/a/ACg8ocICSQ9SMCPqTK7s6JfE7-44O4l3FHAXOVAZY9EmwGFdxbW6vg=mo,Untuk kode otp kenapa selalu tidak valid?,5,0,6.9.3,2024-12-02 04:03:30,,,6.9.3
9b2f9569-0a02-4601-8b3e-142215370786,Budi Gisyul,https://play-lh.googleusercontent.com/a-/ALV-UjWxCw4C9K1r0iApYhlaYR57Rl0Nlm0t-bYthhcP4Jp0aqJaTUOY,lebih mudah cari tiket,4,0,6.7.0,2024-12-02 03:48:29,,,6.7.0
78225784-40c1-4b27-975a-b5229d9424ed,Khaidir Arif,https://play-lh.googleusercontent.com/a/ACg8ocJgQ9rc2zR5Idk2Z4R9Un_a-KyvqVhGlajfCeMRc5dK2FEJEQw=mo,Saya top up KAIpay tapi saldonya tetap 0 padahal transaksi berhasil,1,0,,2024-12-02 01:59:10,,,
42ac3ae0-2843-462f-82f5-11d36e7c242a,deris hendry,https://play-lh.googleusercontent.com/a-/ALV-UjVxpy1fO-89xU0vu8OXHg8YwYePDpoKPNkrdSMbVYTEsKWvtw,"gimana cara ganti pin,?",3,0,6.9.3,2024-12-01 23:00:59,,,6.9.3
729fc3e6-685e-4f76-9e9d-4264eefe460d,Aini Hikmatin Nur Eka,https://play-lh.googleusercontent.com/a/ACg8ocLkauetTJuujvTQNE6kYv3DNJ9YiBq_eX2jIZVAF5YwImEsFg=mo,"Ga bisa masuk, udah di coba berkali kali tetep aja",1,0,,2024-12-01 21:13:06,,,
ad3c26c2-72d2-49cd-b28e-8da486868d53,inayah wulandari,https://play-lh.googleusercontent.com/a/ACg8ocKwfiyGBL7RJDln-_OPs_NrvGLg7QhVVHNIjwlOEQjMgNvatw=mo,Lumayan,4,0,6.5.5,2024-12-01 19:13:05,,,6.5.5
e885cbea-621e-419e-9f46-e679dad8ca03,Novi,https://play-lh.googleusercontent.com/a-/ALV-UjUgDd2OHy89CpvE4mJE3pK7Lba8uQUs9AnKa9IGQuzjukxuYECpjQ,Sisa saldo hilang walau nggak banyak sih tapi tetap aja namanya uang. Setelah tanya sama admin katanya saldonya ikut dengan nomor lama sedangkan aku sudah ganti nomor yang baru padahal dengan akun lama. Mengecewakan,1,0,6.8.1,2024-12-01 19:03:07,,,6.8.1
a544b373-a35d-4bc2-97e3-5a851ac6a20d,Iyan zaskia,https://play-lh.googleusercontent.com/a/ACg8ocL1bgltiN2dSduiZ75oK77mbh0SJExxUlqrupUQwBTgswv_Lw=mo,"pls lah mau daftar aja susah bgt, selalu muter muter di nomer tlpn klo engga email pdhl udah bener. emang paling bener apk yg dulu, kocak bgt bikin bt.",1,1,6.9.3,2024-12-01 15:07:31,,,6.9.3
4ca4f939-0dc2-431e-99b4-e4e2dc12a159,Fahmi Haryadin,https://play-lh.googleusercontent.com/a-/ALV-UjUQDzAAiCUL_hyXusNg1kFhQxiapT6pK8FT1trkZpYLo288ZQQ,"Apk gak jelas, di blacklist masih bisa order tiket. Pas mau nyetak gak bisa buang buang waktu. CS nya pun penjelasan muter muter sampe habis pulsa. And then gua bakal inget muka kondektur yg bernama DIMAS sombong nya nauzubillah",1,0,6.8.1,2024-12-01 14:02:31,,,6.8.1
d710abe7-11a3-4849-967d-e155fb2082bc,lily cwan,https://play-lh.googleusercontent.com/a/ACg8ocKSZxiABugm_mbrjliUUGLdKa9gG1jlpipRsWHPj5J13aigWg=mo,Berulang kali masukan data sudah benar malah di tolak terus,1,0,,2024-12-01 13:55:31,,,
6dbf2689-d4da-4bb9-b21e-46fb637c1e30,Nila Ulfi Rizky Khusnia,https://play-lh.googleusercontent.com/a/ACg8ocJdOoMuFKyZ4yU-90UwV-nFsgJPJK7zimZwYosgdnEjh4fWpA=mo,Good,4,0,,2024-12-01 13:40:40,,,
0ad519b4-b9dd-4b5a-affb-e68b6d85da2a,Muhammad Indra,https://play-lh.googleusercontent.com/a-/ALV-UjW5hMQErfJhVKfhN1Ia4DdgqQRmVf4wk5zK80Zz8w1CgNrBVCOn,lumayanlah dr pd lumanyun,5,0,,2024-12-01 13:26:43,,,
5669794d-3423-48ed-8630-537856b65920,A Leni,https://play-lh.googleusercontent.com/a-/ALV-UjU-bCHi5f5MkK_4Pu_SsVnU8cM29-6jcX_NF-WZtY6WomMlOTY,Mantap,5,0,6.9.3,2024-12-01 12:14:59,,,6.9.3
aac20d79-08be-444d-8403-dad8f1205c52,Denny Ardiyansyah,https://play-lh.googleusercontent.com/a-/ALV-UjWWkN5a8YuipjsCkjNB7Am15cib454BUe0KDjpZCAqOQ7AzsLE0,"aplikasi bosok, pelayanan minus",1,0,6.9.3,2024-12-01 11:14:32,,,6.9.3
f4a39c8a-a287-43f2-b8f1-560d0f212710,Thoriq Kh,https://play-lh.googleusercontent.com/a-/ALV-UjUn7nWfd3-v-aJReX1HGvffRuEoZfssLHl1bULaSBAfVynpPl4,Suka keluar akun sendiri(jadi harus mendaftarkan akun selalu setiap mau beli tiket kereta),1,0,6.8.1,2024-12-01 10:48:41,,,6.8.1
9a4c05f2-351e-4f7c-92b8-98bcdf5e83e9,E. Nakema MITSUBISHI,https://play-lh.googleusercontent.com/a-/ALV-UjWFwehGeHHBLzgxA1U1389dtZSHXhIA0oj7CZfPduoVt4bBcHHT,Susah di akses,2,0,6.9.3,2024-12-01 10:43:05,,,6.9.3
9ac565d9-2c79-4fed-9aff-c4a8942d9249,harry wahyu febriyanto,https://play-lh.googleusercontent.com/a-/ALV-UjV6X4KUTNf7zJHM02vJrBEhlLqO7Ke77gMuXuBCRK0DHn0igWjj,Mengapa daftar akun saat memasukkan kode otp malah otp tidak valid? Badahal sudah benar otpnya,3,0,6.8.1,2024-12-01 10:36:20,,,6.8.1
b0a3c989-1b99-4f70-b491-6c80a78830e2,Wawan Saripudin,https://play-lh.googleusercontent.com/a/ACg8ocKozBgJHl-TyP-R5FinhcK67_s9EqqLzPnhRMd0sQOAQclS7w=mo,5mnit kereta lokal gak bisa masuk alesan hujan..,1,0,6.8.1,2024-12-01 10:13:22,,,6.8.1
2d5eb49e-8d70-4995-bc34-30c5bacfb5ea,Muhammad Salman Rafi,https://play-lh.googleusercontent.com/a-/ALV-UjUfdRpYSOJTNMxh7SRZrEipTPgE9nqpVuWAE8nn66u9WKH-v-iANA,"tiket saya double dengan penumpang lain, dan itu membuat saya tidak nyaman, padahal sudah dapat tempat duduk jadinya harus beridiri tolong diperbaiki sistem pembelian tiketnya",1,0,6.8.1,2024-12-01 10:02:26,,,6.8.1
b91da8a3-3b30-46b9-9586-5c9005c03277,Ridwan Purnama,https://play-lh.googleusercontent.com/a-/ALV-UjV488iIgvLuB8tyP4LrmdL_J37lNtDWzW33W_Gz4H5e03dwmjV7,Nice,4,0,6.9.3,2024-12-01 09:33:25,,,6.9.3
5a0f72ac-aeeb-4616-afee-8eb71139a1d0,Harry D*Z,https://play-lh.googleusercontent.com/a-/ALV-UjUumFDsjlW8FDOazgy5qE2l0wNfwCrMhyxuTWqZBte9YPNsBcw7,"Terlalu lemot aplikasi nya, plis diubah seperti dulu lagi",1,0,6.5.5,2024-12-01 06:09:02,,,6.5.5
7f15151c-74ac-4180-a665-364c62dbd228,Gamer PRO,https://play-lh.googleusercontent.com/a-/ALV-UjX6No9A1N32yQvcb-qXIb1NxX1FEN-30LXdu6QvtwsFSYPqk8U,"Aplikasi konyol, mau bayar loading terus sampai batas waktu, top up tidak masuk sedangkan saldo sudah terpotong",1,0,6.0.29,2024-12-01 05:42:58,,,6.0.29
558a3885-fc6a-432b-a927-c237cb7888e3,Aji Nabawi,https://play-lh.googleusercontent.com/a/ACg8ocKf79MA7FAOZU0L4p4TWFPIfjDbyOIZUWn4rt-eQfDPieWwRw=mo,"Keretanya dingin banget jirrr naikin ngapa jadi 25°-26/27° gak kuat jirrrrrr, dah pake sweter ama jaket padahal",4,0,,2024-12-01 05:39:27,,,
